{
  "schema_version": "runtime-rule-promotion-review/0.1",
  "status": "ROOT_VIDEO_VERIFIED",
  "audio_review_status": "NOT_REQUIRED_FOR_VISUAL_RULES",
  "evidence_reviews": [
    {
      "review_id": "WAVE1-PICTURE-MRR-001",
      "evidence_id": "MRR-S04E07-ACT-FOUR-VISUAL-001",
      "method_id": "MRR-S04E07-ACT-FOUR-VISUAL-001-METHOD-WAVE1-PICTURE-REVIEW",
      "text_anchor": {
        "anchor_id": "MRR-S04E07-ACT-FOUR-VISUAL-001-TA-WAVE1-001",
        "shot_id": "MRR-S04E07-ACT-FOUR-VISUAL-001-S197",
        "source_type": "SUBTITLE",
        "paraphrase": "One participant directly asks whether the other remembers a prior instruction.",
        "speaker_status": "UNKNOWN",
        "start": {"timecode": "00:47:26.800", "seconds": 2846.8},
        "end": {"timecode": "00:47:29.000", "seconds": 2849.0}
      },
      "shot_ids": [
        "MRR-S04E07-ACT-FOUR-VISUAL-001-S001",
        "MRR-S04E07-ACT-FOUR-VISUAL-001-S194",
        "MRR-S04E07-ACT-FOUR-VISUAL-001-S197",
        "MRR-S04E07-ACT-FOUR-VISUAL-001-S199",
        "MRR-S04E07-ACT-FOUR-VISUAL-001-S201"
      ],
      "observations": [
        "The first and last complete Shots visibly delimit the natural scene interval used for applicability review.",
        "The cited complete Shots hold one visible appearance in a clean single for 67.401, 42.042, 20.270, and 31.281 seconds.",
        "Start, midpoint, and end picture review confirms visible posture and facial-state progression inside the held singles.",
        "The cited interval moves from relation coverage to longer isolated ownership without requiring a simultaneous task state in frame."
      ],
      "unknowns": [
        "Other dialogue meaning, emotional cause, cross-cut identity, lens metadata, and all semantic audio remain unknown."
      ],
      "scene_problem": {
        "primary": "INTERROGATION",
        "secondary": [],
        "status": "INFERRED",
        "source_refs": [
          "MRR-S04E07-ACT-FOUR-VISUAL-001-S194",
          "MRR-S04E07-ACT-FOUR-VISUAL-001-S197",
          "MRR-S04E07-ACT-FOUR-VISUAL-001-S199",
          "MRR-S04E07-ACT-FOUR-VISUAL-001-TA-WAVE1-001"
        ],
        "notes": "The canonical problem is inferred from repeated question-and-response staging plus one short, paraphrased visible-text anchor; no dialogue wording is transferred."
      },
      "roles": [
        {
          "shot_id": "MRR-S04E07-ACT-FOUR-VISUAL-001-S194",
          "appearance_id": "APPEARANCE-S194",
          "functional_role": "performance_owner",
          "source_refs": ["MRR-S04E07-ACT-FOUR-VISUAL-001-S194"]
        },
        {
          "shot_id": "MRR-S04E07-ACT-FOUR-VISUAL-001-S197",
          "appearance_id": "APPEARANCE-S197",
          "functional_role": "performance_owner",
          "source_refs": ["MRR-S04E07-ACT-FOUR-VISUAL-001-S197"]
        }
      ]
    },
    {
      "review_id": "WAVE1-PICTURE-B99-001",
      "evidence_id": "B99-S05E14-THE-BOX-PRIDE-BAIT-CONFESSION-001",
      "method_id": "B99-S05E14-THE-BOX-PRIDE-BAIT-CONFESSION-001-METHOD-WAVE1-PICTURE-REVIEW",
      "text_anchor": null,
      "shot_ids": ["B99-S05E14-THE-BOX-PRIDE-BAIT-CONFESSION-001-S016"],
      "observations": [
        "Start, midpoint, and end frames confirm a 17.125-second clean single that retains one visible performance progression before the coverage changes."
      ],
      "unknowns": ["Dialogue meaning, emotional cause, lens metadata, and all semantic audio remain unknown."],
      "scene_problem": null,
      "roles": []
    },
    {
      "review_id": "WAVE1-PICTURE-BCS-001",
      "evidence_id": "BETTER-CALL-SAUL-S03E05-PUBLIC-PROOF-001",
      "method_id": "BETTER-CALL-SAUL-S03E05-PUBLIC-PROOF-001-METHOD-WAVE1-PICTURE-REVIEW",
      "text_anchor": null,
      "shot_ids": [
        "BETTER-CALL-SAUL-S03E05-PUBLIC-PROOF-001-S097",
        "BETTER-CALL-SAUL-S03E05-PUBLIC-PROOF-001-S098"
      ],
      "observations": [
        "Start, midpoint, and end frames confirm a 71.917-second held single followed by a return to relation coverage."
      ],
      "unknowns": ["Dialogue meaning, emotional cause, cross-cut identity, lens metadata, and all semantic audio remain unknown."],
      "scene_problem": null,
      "roles": []
    },
    {
      "review_id": "WAVE1-PICTURE-DWP-001",
      "evidence_id": "THE-DEVIL-WEARS-PRADA-2006-CERULEAN-CORRECTION-001",
      "method_id": "THE-DEVIL-WEARS-PRADA-2006-CERULEAN-CORRECTION-001-METHOD-WAVE1-PICTURE-REVIEW",
      "text_anchor": null,
      "shot_ids": [
        "THE-DEVIL-WEARS-PRADA-2006-CERULEAN-CORRECTION-001-S012",
        "THE-DEVIL-WEARS-PRADA-2006-CERULEAN-CORRECTION-001-S013",
        "THE-DEVIL-WEARS-PRADA-2006-CERULEAN-CORRECTION-001-S015",
        "THE-DEVIL-WEARS-PRADA-2006-CERULEAN-CORRECTION-001-S016",
        "THE-DEVIL-WEARS-PRADA-2006-CERULEAN-CORRECTION-001-S017",
        "THE-DEVIL-WEARS-PRADA-2006-CERULEAN-CORRECTION-001-S018",
        "THE-DEVIL-WEARS-PRADA-2006-CERULEAN-CORRECTION-001-S019"
      ],
      "observations": [
        "The cited sequence repeatedly preserves a principal visible performer together with concurrent material and other-body task state.",
        "Short receiver checks are interleaved instead of replacing the shared work frame with one uninterrupted clean single."
      ],
      "unknowns": ["Dialogue meaning, emotional cause, cross-cut identity, lens metadata, and all semantic audio remain unknown."],
      "scene_problem": null,
      "roles": []
    },
    {
      "review_id": "WAVE1-PICTURE-MS-001",
      "evidence_id": "MARRIAGE-STORY-2019-APARTMENT-SEQUENCE-001",
      "method_id": "MARRIAGE-STORY-2019-APARTMENT-SEQUENCE-001-METHOD-WAVE1-PICTURE-REVIEW",
      "text_anchor": {
        "anchor_id": "MARRIAGE-STORY-2019-APARTMENT-SEQUENCE-001-TA-WAVE1-001",
        "shot_id": "MARRIAGE-STORY-2019-APARTMENT-SEQUENCE-001-S071",
        "source_type": "SUBTITLE",
        "paraphrase": "The exchange turns into a direct personal comparison used as an accusation between the two participants.",
        "speaker_status": "UNKNOWN",
        "start": {"timecode": "01:38:29.800", "seconds": 5909.8},
        "end": {"timecode": "01:38:31.500", "seconds": 5911.5}
      },
      "shot_ids": [
        "MARRIAGE-STORY-2019-APARTMENT-SEQUENCE-001-S001",
        "MARRIAGE-STORY-2019-APARTMENT-SEQUENCE-001-S049",
        "MARRIAGE-STORY-2019-APARTMENT-SEQUENCE-001-S058",
        "MARRIAGE-STORY-2019-APARTMENT-SEQUENCE-001-S059",
        "MARRIAGE-STORY-2019-APARTMENT-SEQUENCE-001-S061",
        "MARRIAGE-STORY-2019-APARTMENT-SEQUENCE-001-S065",
        "MARRIAGE-STORY-2019-APARTMENT-SEQUENCE-001-S071",
        "MARRIAGE-STORY-2019-APARTMENT-SEQUENCE-001-S082",
        "MARRIAGE-STORY-2019-APARTMENT-SEQUENCE-001-S083",
        "MARRIAGE-STORY-2019-APARTMENT-SEQUENCE-001-S084",
        "MARRIAGE-STORY-2019-APARTMENT-SEQUENCE-001-S085"
      ],
      "observations": [
        "The first and last complete Shots visibly delimit the natural scene interval used for applicability review.",
        "The cited complete Shots visibly carry seated-to-standing, room-zone crossing, and level changes in shared or continuously reframed relation coverage.",
        "The final cited Shots preserve both participants and the changed level-and-distance endpoint before the interval ends."
      ],
      "unknowns": ["Other dialogue meaning, emotional cause, exact distance, lens metadata, and all semantic audio remain unknown."],
      "scene_problem": {
        "primary": "RELATIONSHIP_FRACTURE",
        "secondary": [],
        "status": "INFERRED",
        "source_refs": [
          "MARRIAGE-STORY-2019-APARTMENT-SEQUENCE-001-S049",
          "MARRIAGE-STORY-2019-APARTMENT-SEQUENCE-001-S059",
          "MARRIAGE-STORY-2019-APARTMENT-SEQUENCE-001-S085",
          "MARRIAGE-STORY-2019-APARTMENT-SEQUENCE-001-TA-WAVE1-001"
        ],
        "notes": "The canonical problem is inferred from repeated visible relation resets plus one short, paraphrased visible-text anchor showing direct personal conflict; no dialogue wording is transferred."
      },
      "roles": [
        {
          "shot_id": "MARRIAGE-STORY-2019-APARTMENT-SEQUENCE-001-S059",
          "appearance_id": "P-B",
          "functional_role": "spatial_mover",
          "source_refs": ["MARRIAGE-STORY-2019-APARTMENT-SEQUENCE-001-S059"]
        },
        {
          "shot_id": "MARRIAGE-STORY-2019-APARTMENT-SEQUENCE-001-S059",
          "appearance_id": "P-A",
          "functional_role": "relation_anchor",
          "source_refs": ["MARRIAGE-STORY-2019-APARTMENT-SEQUENCE-001-S059"]
        }
      ]
    },
    {
      "review_id": "WAVE1-PICTURE-TLOU-001",
      "evidence_id": "TLOU-BEDROOM-LOCAL-001",
      "method_id": "TLOU-BEDROOM-LOCAL-001-METHOD-WAVE1-PICTURE-REVIEW",
      "text_anchor": null,
      "shot_ids": [
        "TLOU-BEDROOM-LOCAL-001-S015",
        "TLOU-BEDROOM-LOCAL-001-S016",
        "TLOU-BEDROOM-LOCAL-001-S017",
        "TLOU-BEDROOM-LOCAL-001-S018",
        "TLOU-BEDROOM-LOCAL-001-S019"
      ],
      "observations": [
        "The shared seated-to-standing transition is followed by standing singles and a later shared geometry reset."
      ],
      "unknowns": ["Dialogue meaning, emotional cause, cross-cut identity, lens metadata, and all semantic audio remain unknown."],
      "scene_problem": null,
      "roles": []
    },
    {
      "review_id": "WAVE1-PICTURE-TSN-001",
      "evidence_id": "THE-SOCIAL-NETWORK-2010-OPENING-TWO-PERSON-EXCHANGE-001",
      "method_id": "THE-SOCIAL-NETWORK-2010-OPENING-TWO-PERSON-EXCHANGE-001-METHOD-WAVE1-PICTURE-REVIEW",
      "text_anchor": null,
      "shot_ids": [
        "THE-SOCIAL-NETWORK-2010-OPENING-TWO-PERSON-EXCHANGE-001-S090",
        "THE-SOCIAL-NETWORK-2010-OPENING-TWO-PERSON-EXCHANGE-001-S091"
      ],
      "observations": [